{
  "schemaVersion": "finance-observation-selection.v0.1",
  "id": "managed-observation-selection",
  "version": "0.1.0",
  "common": [
    "repo://contracts/fixtures/observation/readonly-requirements.v0.1.json"
  ],
  "units": [
    {
      "id": "balance",
      "capabilityIds": [
        "account.balance.query"
      ],
      "source": "repo://observation-packs/readonly/balance.json"
    },
    {
      "id": "wealth",
      "capabilityIds": [
        "wealth.facts.describe"
      ],
      "source": "repo://observation-packs/readonly/wealth.json"
    },
    {
      "id": "cashflow",
      "capabilityIds": [
        "finance.transaction-summary.query",
        "finance.spending-analysis.query"
      ],
      "source": "repo://observation-packs/readonly/cashflow.json"
    },
    {
      "id": "internal-transfer",
      "capabilityIds": [
        "transfer.internal.create"
      ],
      "source": "repo://capability-packs/internal-transfer/observation.v0.1.json"
    },
    {
      "id": "channel-preferences",
      "capabilityIds": [
        "channel.preferences.update"
      ],
      "source": "repo://capability-packs/channel-preferences/observation.v0.1.json"
    },
    {
      "id": "wealth-customer-context",
      "capabilityIds": [
        "wealth.customer-context.query"
      ],
      "source": "repo://capability-packs/wealth-customer-context/observation.v0.1.json"
    },
    {
      "id": "wealth-manager-previsit",
      "capabilityIds": [
        "wealth.previsit-context.query"
      ],
      "source": "repo://capability-packs/wealth-manager-previsit/observation.v0.1.json"
    },
    {
      "id": "wealth-allocation-context",
      "capabilityIds": [
        "wealth.allocation-context.query"
      ],
      "source": "repo://capability-packs/wealth-allocation-context/observation.v0.1.json"
    },
    {
      "id": "enterprise-financial-statement-verification",
      "capabilityIds": [
        "enterprise.financial-statement.verify"
      ],
      "source": "repo://capability-packs/enterprise-financial-statement-verification/observation.v0.1.json"
    },
    {
      "id": "enterprise-application-contract-verification",
      "capabilityIds": [
        "enterprise.application-contract.verify"
      ],
      "source": "repo://capability-packs/enterprise-application-contract-verification/observation.v0.1.json"
    },
    {
      "id": "fraud-risk-evidence-query",
      "capabilityIds": [
        "fraud.risk-evidence.query"
      ],
      "source": "repo://capability-packs/fraud-risk-evidence-query/observation.v0.1.json"
    }
  ]
}
